{
  "authority_status": "ILLUSTRATIVE_ONLY",
  "runtime_eligible": false,
  "proposal_status": "OPTIONAL_FUTURE_PROPOSAL",
  "passport_id": "PP-VEH000001-DOOR-FL-001",
  "component_instance_id": "CMPINST-VEH000001-DOOR-FL",
  "vehicle_instance_id": "VEH-000001",
  "configuration_id": "CFG-000001",
  "configuration_fingerprint": "sha256:dde6a6251b97900dc192587903ce30a236de18f311996231a3f488ef0429d943",
  "reusable_definition_id": "CMPDEF-DOOR-FRONT-LH-0001",
  "status_summary": {
    "evidence": "CANDIDATE",
    "geometry": "ABSENT",
    "interaction": "ABSENT"
  },
  "links": {
    "evidence_link_ids": [],
    "geometry_asset_ids": [],
    "relationship_ids": ["REL-VEH000001-0001"],
    "interaction_ids": [],
    "connection_relationship_ids": [],
    "procedure_dependency_ids": []
  },
  "geometry_roles": [],
  "quality_assessment": {
    "score": null,
    "scoring_status": "NOT_EVALUATED",
    "rubric_version": null,
    "score_inputs": null
  },
  "schema_version": "1.1.0-proposal",
  "composition_notes": "Do not compose via allOf against rc1 additionalProperties:false. This file is a complete restatement draft.",
  "notes": "ILLUSTRATIVE ONLY — stored under proposals/examples/, not examples/2019_f450/. Candidates remain in L1_LANE_A_ASSET_CATALOG.json. No usable geometry. No verified procedure. Full CFG fingerprint only."
}
